{
 "next": "Walk the Scenario you care about, then read the rule that blocks a merge.",
 "screens": {
  "conversation": {
   "title": "Pull request / Conversation",
   "size": "1280",
   "blocks": [
    {
     "id": "head",
     "name": "Header",
     "type": "title",
     "text": "Add retry to sync job #482",
     "sub": "Open · mina wants to merge 3 commits into main from retry-sync"
    },
    {
     "id": "tabs",
     "name": "Tabs",
     "type": "tabs",
     "items": ["Conversation", "Commits 3", "Checks 2", "Files changed 4"],
     "active": 0
    },
    {
     "id": "timeline",
     "name": "Timeline",
     "type": "list",
     "items": [
      "mina opened this pull request",
      "jun requested changes",
      "mina pushed 1 commit",
      "jun approved these changes"
     ]
    },
    {
     "id": "checks",
     "name": "Checks",
     "type": "list",
     "items": ["✓ ci / build — passed", "✓ ci / test — passed"]
    },
    {"id": "merge", "name": "Merge box", "type": "button", "text": "Merge pull request"}
   ]
  },
  "files": {
   "title": "Pull request / Files changed",
   "size": "1280",
   "blocks": [
    {
     "id": "head",
     "name": "Header",
     "type": "title",
     "text": "Add retry to sync job #482",
     "sub": "4 files changed · +38 −6"
    },
    {
     "id": "tabs",
     "name": "Tabs",
     "type": "tabs",
     "items": ["Conversation", "Commits 3", "Checks 2", "Files changed 4"],
     "active": 3
    },
    {
     "id": "diff",
     "name": "Diff",
     "type": "code",
     "items": ["  def sync(job):", "-     run(job)", "+     retry(run, job, times=3)"]
    },
    {
     "id": "comment",
     "name": "Line comment",
     "type": "text",
     "text": "jun · 세 번이면 충분할까요? 백오프도 넣어 주세요."
    },
    {
     "id": "submit",
     "name": "Review",
     "type": "choices",
     "items": ["Comment", "Approve", "Request changes"],
     "active": 2,
     "text": "Submit review"
    }
   ]
  }
 },
 "plan": {
  "views": [
   {"name": "Pull request state machine", "level": "root"},
   {"name": "Review flow", "level": "open-s"},
   {"name": "Local and remote branch sync", "level": "push"},
   {"name": "Pull request data model", "level": "review"},
   {
    "name": "Merge sequence between Git and GitHub",
    "why": "시퀀스 그림이 아직 없어, Branch sync 레벨의 두 영역과 동기화가 그 순서를 대신 보입니다."
   }
  ]
 },
 "levels": {
  "root": {
   "nodes": {
    "draft-s": {"x": 0, "y": 0},
    "open-s": {"x": 1, "y": 0},
    "closed-s": {"x": 2, "y": 0},
    "merged-s": {"x": 1, "y": 1}
   }
  },
  "open-s": {
   "nodes": {
    "push": {"x": 0, "y": 0},
    "checks": {"x": 1, "y": 0, "ui": {"screen": "conversation", "block": "checks"}},
    "review": {"x": 2, "y": 0, "ui": {"screen": "files", "block": "submit"}},
    "mergebox": {"x": 2, "y": 1, "ui": {"screen": "conversation", "block": "merge"}}
   }
  },
  "push": {
   "nodes": {
    "clean": {"x": 0, "y": 0},
    "unpushed": {"x": 1, "y": 0},
    "matching": {"x": 0, "y": 1},
    "ahead": {"x": 1, "y": 1}
   }
  },
  "review": {
   "nodes": {
    "pr": {"x": 0, "y": 0},
    "branch": {"x": 1, "y": 0},
    "commit": {"x": 1, "y": 1},
    "review-x": {"x": 0, "y": 1},
    "comment": {"x": 0, "y": 2, "ui": {"screen": "files", "block": "comment"}},
    "line": {"x": 1, "y": 2, "ui": {"screen": "files", "block": "diff"}}
   }
  }
 }
}
